{
  "anva_sources": [
    {
      "canonical_url": "https://example.test/decisions/checkout",
      "content_hash": "aaaaaaaaaaaaaaaaaaaaaaaaaaaaaaaaaaaaaaaaaaaaaaaaaaaaaaaaaaaaaaaa",
      "locator": "ADR-42",
      "observed_at": "2026-07-28T00:00:00Z",
      "revision_id": "00000000-0000-4000-8000-000000000102",
      "source_id": "00000000-0000-4000-8000-000000000101",
      "source_type": "DECISION"
    }
  ],
  "code": "MISSING_MIGRATION_EVIDENCE",
  "description": "The policy requires a migration compatibility check.",
  "evidence_ids": [],
  "finding_id": "00000000-0000-4000-8000-000000000201",
  "limitations": [
    "No deployment environment was evaluated."
  ],
  "organization_id": "00000000-0000-4000-8000-000000000001",
  "schema_version": "1.0",
  "severity": "BLOCKING",
  "title": "Migration evidence is missing"
}
